{"authority":false,"binding":{"backendId":"weft.postgresql.current-read-candidate","backendVersion":"0.1-candidate","sha256":"58636458238a88099200648d2442e3095b51ac540176d45bae26e6d20ebd2eff","source":{"documentId":"fixture-current-pg","revision":"barrier-r1"},"targetProfile":"pg18.6-barrier/0.1-candidate"},"modelPins":[{"documentId":"domain","revision":"query-value-core-r1","sha256":"efa88c4ee1af9cd8252a3aa4f5d0c70dcdaf6660962b3d98ae18c77d4b2baa6a","umfVersion":"0.8.0"}],"originalActionRequiredPurpose":"original-authorized","primaryAction":"read","primaryActionRequiredPurpose":"read","securityReady":false,"sourceProfileJson":"{\"version\":\"weft.current-query.designation-profile/0.1-candidate\",\"id\":\"weft-current-query-actions\",\"revision\":\"query-value-designation-r1\",\"modelPins\":[{\"documentId\":\"domain\",\"revision\":\"query-value-core-r1\",\"umfVersion\":\"0.8.0\",\"sha256\":\"efa88c4ee1af9cd8252a3aa4f5d0c70dcdaf6660962b3d98ae18c77d4b2baa6a\"}],\"sources\":[{\"role\":\"policy\",\"identity\":{\"documentId\":\"project-access\",\"revision\":\"query-value-policy-r1\"},\"sha256\":\"7d5933b9d8a0d1735dbf3c6f7d4939104eec6d2b3753b5ac4c4eec454aaeb789\"},{\"role\":\"ontology\",\"identity\":{\"documentId\":\"domain\",\"revision\":\"query-value-ontology-r1\"},\"sha256\":\"38a276a97d72974bd756e20d779fe1b45141f9d10847f0da587f55c40f06f3b7\"},{\"role\":\"catalog\",\"identity\":{\"documentId\":\"stored\",\"revision\":\"query-value-catalog-r1\"},\"sha256\":\"d55d8799e3f6d808c45b65e2d4f6da3577926716ddf61a43b7802ff4bfdc3745\"},{\"role\":\"owner\",\"identity\":{\"documentId\":\"owner\",\"revision\":\"query-value-owner-r1\"},\"sha256\":\"bb626e8e3cf5ca5a25739d62ce62695e5f0c541278a91bb2fabc2411dd8f2337\"}],\"binding\":{\"backendId\":\"weft.postgresql.current-read-candidate\",\"backendVersion\":\"0.1-candidate\",\"targetProfile\":\"pg18.6-barrier/0.1-candidate\",\"source\":{\"documentId\":\"fixture-current-pg\",\"revision\":\"barrier-r1\"},\"sha256\":\"58636458238a88099200648d2442e3095b51ac540176d45bae26e6d20ebd2eff\"},\"targets\":[{\"documentId\":\"domain\",\"moduleId\":\"m\",\"elementId\":\"Resource\"}],\"primaryAction\":\"read\",\"bindings\":[{\"target\":{\"documentId\":\"domain\",\"moduleId\":\"m\",\"elementId\":\"Resource\"},\"field\":{\"documentId\":\"domain\",\"moduleId\":\"m\",\"elementId\":\"salary\"},\"operator\":\"predicate\",\"originalAction\":\"query-original-salary-predicate\"},{\"target\":{\"documentId\":\"domain\",\"moduleId\":\"m\",\"elementId\":\"Resource\"},\"field\":{\"documentId\":\"domain\",\"moduleId\":\"m\",\"elementId\":\"token\"},\"operator\":\"order\",\"originalAction\":\"query-original-token-order\"}]}","sourceProfileSha256":"fa3351c26dbe2f678ad08a5eb275ab21194310bc6506726449abfbe9bf7ba487","sourceRequestSha256":"2006b2573acb96efba0b345c76ac3330c773cb0a4e8d500af44420bbd4db8d01","sources":[{"identity":{"documentId":"project-access","revision":"query-value-policy-r1"},"role":"policy","sha256":"7d5933b9d8a0d1735dbf3c6f7d4939104eec6d2b3753b5ac4c4eec454aaeb789"},{"identity":{"documentId":"domain","revision":"query-value-ontology-r1"},"role":"ontology","sha256":"38a276a97d72974bd756e20d779fe1b45141f9d10847f0da587f55c40f06f3b7"},{"identity":{"documentId":"stored","revision":"query-value-catalog-r1"},"role":"catalog","sha256":"d55d8799e3f6d808c45b65e2d4f6da3577926716ddf61a43b7802ff4bfdc3745"},{"identity":{"documentId":"owner","revision":"query-value-owner-r1"},"role":"owner","sha256":"bb626e8e3cf5ca5a25739d62ce62695e5f0c541278a91bb2fabc2411dd8f2337"}],"unresolved":["UMF whole-source semantic admission","joint ontology/catalog query modes","per-occurrence effective value and paired native scope","authenticated native source/caller/current authority and guarded release"],"uses":[{"field":{"documentId":"domain","elementId":"salary","moduleId":"m"},"fieldIdentity":{"documentId":"domain","element":"salary","module":"m","revision":"query-value-core-r1"},"operation":"order","operator":"order","originalAction":null,"path":"order/0","scan":"s0","target":{"documentId":"domain","elementId":"Resource","moduleId":"m"}}],"version":"weft.current-query.designation/0.1-candidate"}